smartctl 7.2 2020-12-30 r5155 [x86_64-linux-5.15.0-67-generic] (local build)
Copyright (C) 2002-20, Bruce Allen, Christian Franke, www.smartmontools.org

=== START OF INFORMATION SECTION ===
Model Family:     Seagate Momentus 7200.4
Device Model:     ST9500420ASG
Serial Number:    5VJ0B61B
LU WWN Device Id: 5 000c50 0167fb919
Firmware Version: 0002SDM1
User Capacity:    500,107,862,016 bytes [500 GB]
Sector Size:      512 bytes logical/physical
Rotation Rate:    7200 rpm
Device is:        In smartctl database [for details use: -P show]
ATA Version is:   ATA8-ACS T13/1699-D revision 4
SATA Version is:  SATA 2.6, 3.0 Gb/s
Local Time is:    Tue Mar  7 20:12:03 2023 EET
SMART support is: Available - device has SMART capability.
SMART support is: Enabled

=== START OF READ SMART DATA SECTION ===
SMART overall-health self-assessment test result: PASSED
See vendor-specific Attribute list for marginal Attributes.

General SMART Values:
Offline data collection status:  (0x82)	Offline data collection activity
					was completed without error.
					Auto Offline Data Collection: Enabled.
Self-test execution status:      (   0)	The previous self-test routine completed
					without error or no self-test has ever 
					been run.
Total time to complete Offline 
data collection: 		(    0) seconds.
Offline data collection
capabilities: 			 (0x7b) SMART execute Offline immediate.
					Auto Offline data collection on/off support.
					Suspend Offline collection upon new
					command.
					Offline surface scan supported.
					Self-test supported.
					Conveyance Self-test supported.
					Selective Self-test supported.
SMART capabilities:            (0x0003)	Saves SMART data before entering
					power-saving mode.
					Supports SMART auto save timer.
Error logging capability:        (0x01)	Error logging supported.
					General Purpose Logging supported.
Short self-test routine 
recommended polling time: 	 (   2) minutes.
Extended self-test routine
recommended polling time: 	 ( 111) minutes.
Conveyance self-test routine
recommended polling time: 	 (   3) minutes.
SCT capabilities: 	       (0x103f)	SCT Status supported.
					SCT Error Recovery Control supported.
					SCT Feature Control supported.
					SCT Data Table supported.

SMART Attributes Data Structure revision number: 10
Vendor Specific SMART Attributes with Thresholds:
ID# ATTRIBUTE_NAME          FLAG     VALUE WORST THRESH TYPE      UPDATED  WHEN_FAILED RAW_VALUE
  1 Raw_Read_Error_Rate     0x000f   114   100   006    Pre-fail  Always       -       60720417
  3 Spin_Up_Time            0x0003   100   096   085    Pre-fail  Always       -       0
  4 Start_Stop_Count        0x0032   100   100   020    Old_age   Always       -       333
  5 Reallocated_Sector_Ct   0x0033   100   100   036    Pre-fail  Always       -       0
  7 Seek_Error_Rate         0x000f   064   060   030    Pre-fail  Always       -       12893914402
  9 Power_On_Hours          0x0032   100   100   000    Old_age   Always       -       727
 10 Spin_Retry_Count        0x0013   100   100   097    Pre-fail  Always       -       0
 12 Power_Cycle_Count       0x0032   100   037   020    Old_age   Always       -       276
184 End-to-End_Error        0x0032   100   100   099    Old_age   Always       -       0
187 Reported_Uncorrect      0x0032   100   100   000    Old_age   Always       -       0
188 Command_Timeout         0x0032   100   098   000    Old_age   Always       -       264
189 High_Fly_Writes         0x003a   100   100   000    Old_age   Always       -       0
190 Airflow_Temperature_Cel 0x0022   061   044   045    Old_age   Always   In_the_past 39 (0 3 39 37 0)
191 G-Sense_Error_Rate      0x0032   100   100   000    Old_age   Always       -       0
192 Power-Off_Retract_Count 0x0032   100   100   000    Old_age   Always       -       42
193 Load_Cycle_Count        0x0032   099   099   000    Old_age   Always       -       3021
194 Temperature_Celsius     0x0022   039   056   000    Old_age   Always       -       39 (243 52 0 0 0)
195 Hardware_ECC_Recovered  0x001a   045   040   000    Old_age   Always       -       60720417
197 Current_Pending_Sector  0x0012   100   100   000    Old_age   Always       -       0
198 Offline_Uncorrectable   0x0010   100   100   000    Old_age   Offline      -       0
199 UDMA_CRC_Error_Count    0x003e   200   200   000    Old_age   Always       -       0
240 Head_Flying_Hours       0x0000   100   253   000    Old_age   Offline      -       708 (249 165 0)
241 Total_LBAs_Written      0x0000   100   253   000    Old_age   Offline      -       1402404099
242 Total_LBAs_Read         0x0000   100   253   000    Old_age   Offline      -       2328020157
254 Free_Fall_Sensor        0x0032   001   001   000    Old_age   Always       -       6

SMART Error Log Version: 1
No Errors Logged

SMART Self-test log structure revision number 1
No self-tests have been logged.  [To run self-tests, use: smartctl -t]

SMART Selective self-test log data structure revision number 1
 SPAN  MIN_LBA  MAX_LBA  CURRENT_TEST_STATUS
    1        0        0  Not_testing
    2        0        0  Not_testing
    3        0        0  Not_testing
    4        0        0  Not_testing
    5        0        0  Not_testing
Selective self-test flags (0x0):
  After scanning selected spans, do NOT read-scan remainder of disk.
If Selective self-test is pending on power-up, resume after 0 minute delay.



    1  sudo apt-get update
    2  git clone https://github.com/tlubenov/system-init.git
    3  sudo apt-get install git
    4  git clone https://github.com/tlubenov/system-init.git
    5  cd system-init/
    6  sudo apt-get install /home/maps/Downloads/code_1.76.0-1677667493_amd64.deb 
    7  iostat -En
    8  cfgadm
    9  hdparm -i /dev/sda
   10  sudo hdparm -i /dev/sda
   11  smartctl -a /dev/sda
   12  sudo apt-get install smartctl
   13  sudo apt-get install smartmontools
   14  sudo smartctl -i /dev/sda
   15  sudo smartctl -a /dev/sda
   16  ls
   17  sudo smartctl -a /dev/sda >> v20230306-v2004LTS
   18  ls
   19  code .
   20  echo >> v20230306-v2004LTS 
   21  history >>v20230306-v2004LTS 
