mapserver-ThinkCentre-M93p


Distributor ID:	Ubuntu
Description:	Ubuntu 20.04.5 LTS
Release:	20.04
Codename:	focal
-
-
smartctl 7.1 2019-12-30 r5022 [x86_64-linux-5.13.0-37-generic] (local build)
Copyright (C) 2002-19, Bruce Allen, Christian Franke, www.smartmontools.org

=== START OF INFORMATION SECTION ===
Model Family:     Western Digital Scorpio Black
Device Model:     WDC WD3200BEKT-75PVMT0
Serial Number:    WD-WXF1AC0D4270
LU WWN Device Id: 5 0014ee 600ec4bf1
Firmware Version: 01.01A01
User Capacity:    320,072,933,376 bytes [320 GB]
Sector Size:      512 bytes logical/physical
Rotation Rate:    7200 rpm
Device is:        In smartctl database [for details use: -P show]
ATA Version is:   ATA8-ACS (minor revision not indicated)
SATA Version is:  SATA 2.6, 3.0 Gb/s
Local Time is:    Wed Mar  8 00:02:14 2023 EET
SMART support is: Available - device has SMART capability.
SMART support is: Enabled

=== START OF READ SMART DATA SECTION ===
SMART overall-health self-assessment test result: PASSED

General SMART Values:
Offline data collection status:  (0x00)	Offline data collection activity
					was never started.
					Auto Offline Data Collection: Disabled.
Self-test execution status:      (   0)	The previous self-test routine completed
					without error or no self-test has ever 
					been run.
Total time to complete Offline 
data collection: 		( 6060) seconds.
Offline data collection
capabilities: 			 (0x7b) SMART execute Offline immediate.
					Auto Offline data collection on/off support.
					Suspend Offline collection upon new
					command.
					Offline surface scan supported.
					Self-test supported.
					Conveyance Self-test supported.
					Selective Self-test supported.
SMART capabilities:            (0x0003)	Saves SMART data before entering
					power-saving mode.
					Supports SMART auto save timer.
Error logging capability:        (0x01)	Error logging supported.
					General Purpose Logging supported.
Short self-test routine 
recommended polling time: 	 (   2) minutes.
Extended self-test routine
recommended polling time: 	 (  63) minutes.
Conveyance self-test routine
recommended polling time: 	 (   5) minutes.
SCT capabilities: 	       (0x7035)	SCT Status supported.
					SCT Feature Control supported.
					SCT Data Table supported.

SMART Attributes Data Structure revision number: 16
Vendor Specific SMART Attributes with Thresholds:
ID# ATTRIBUTE_NAME          FLAG     VALUE WORST THRESH TYPE      UPDATED  WHEN_FAILED RAW_VALUE
  1 Raw_Read_Error_Rate     0x002f   200   200   051    Pre-fail  Always       -       1
  3 Spin_Up_Time            0x0027   164   156   021    Pre-fail  Always       -       791
  4 Start_Stop_Count        0x0032   098   098   000    Old_age   Always       -       2271
  5 Reallocated_Sector_Ct   0x0033   200   200   140    Pre-fail  Always       -       0
  7 Seek_Error_Rate         0x002e   200   200   000    Old_age   Always       -       0
  9 Power_On_Hours          0x0032   078   078   000    Old_age   Always       -       16399
 10 Spin_Retry_Count        0x0032   100   100   000    Old_age   Always       -       0
 11 Calibration_Retry_Count 0x0032   100   100   000    Old_age   Always       -       0
 12 Power_Cycle_Count       0x0032   098   098   000    Old_age   Always       -       2267
191 G-Sense_Error_Rate      0x0032   001   001   000    Old_age   Always       -       31503
192 Power-Off_Retract_Count 0x0032   200   200   000    Old_age   Always       -       94
193 Load_Cycle_Count        0x0032   088   088   000    Old_age   Always       -       338161
194 Temperature_Celsius     0x0022   108   081   000    Old_age   Always       -       35
196 Reallocated_Event_Count 0x0032   200   200   000    Old_age   Always       -       0
197 Current_Pending_Sector  0x0032   200   200   000    Old_age   Always       -       0
198 Offline_Uncorrectable   0x0030   100   253   000    Old_age   Offline      -       0
199 UDMA_CRC_Error_Count    0x0032   200   200   000    Old_age   Always       -       0
200 Multi_Zone_Error_Rate   0x0008   100   253   000    Old_age   Offline      -       0
240 Head_Flying_Hours       0x0032   078   078   000    Old_age   Always       -       16213
241 Total_LBAs_Written      0x0032   200   200   000    Old_age   Always       -       19879841528
242 Total_LBAs_Read         0x0032   200   200   000    Old_age   Always       -       20807920327
254 Free_Fall_Sensor        0x0032   109   109   000    Old_age   Always       -       91

SMART Error Log Version: 1
No Errors Logged

SMART Self-test log structure revision number 1
Num  Test_Description    Status                  Remaining  LifeTime(hours)  LBA_of_first_error
# 1  Short offline       Completed without error       00%      9267         -
# 2  Short offline       Completed without error       00%      6525         -
# 3  Short offline       Completed without error       00%         0         -
# 4  Short offline       Completed without error       00%         0         -
# 5  Short offline       Completed without error       00%         0         -

SMART Selective self-test log data structure revision number 1
 SPAN  MIN_LBA  MAX_LBA  CURRENT_TEST_STATUS
    1        0        0  Not_testing
    2        0        0  Not_testing
    3        0        0  Not_testing
    4        0        0  Not_testing
    5        0        0  Not_testing
Selective self-test flags (0x0):
  After scanning selected spans, do NOT read-scan remainder of disk.
If Selective self-test is pending on power-up, resume after 0 minute delay.

